{"armSummaries":[{"arm":"sequential","attemptedStoryCount":1,"firstPassCount":1,"measuredAttemptCount":1,"medianElapsedMs":"1000","metrics":{"checkFailures":0,"checkReruns":0,"conflictsAutoResolved":0,"conflictsDetected":0,"conflictsManualResolved":0,"conflictsUnresolved":0,"interventions":0,"manualEdits":0,"repairDispatches":0,"retries":0,"scopeViolations":0,"staleHeadEvents":0,"timeouts":0},"successfulStoryCount":1,"terminalStatusCounts":{"blocked":0,"failed":0,"green":1,"incomparable":0,"timed-out":0},"tokens":{"cacheWriteInputTokens":0,"cachedInputRatio":null,"cachedInputTokens":0,"comparisonTokens":0,"comparisonTokensPerAttemptedStory":"0.000000","comparisonTokensPerSuccessfulStory":"0.000000","failedAttemptComparisonTokens":0,"inputTokens":0,"outputTokens":0,"reasoningOutputShare":null,"reasoningOutputTokens":0,"retryComparisonTokens":0},"warmupAttemptCount":0},{"arm":"parallel","attemptedStoryCount":1,"firstPassCount":1,"measuredAttemptCount":1,"medianElapsedMs":"700","metrics":{"checkFailures":0,"checkReruns":0,"conflictsAutoResolved":0,"conflictsDetected":0,"conflictsManualResolved":0,"conflictsUnresolved":0,"interventions":0,"manualEdits":0,"repairDispatches":0,"retries":0,"scopeViolations":0,"staleHeadEvents":0,"timeouts":0},"successfulStoryCount":1,"terminalStatusCounts":{"blocked":0,"failed":0,"green":1,"incomparable":0,"timed-out":0},"tokens":{"cacheWriteInputTokens":0,"cachedInputRatio":null,"cachedInputTokens":0,"comparisonTokens":0,"comparisonTokensPerAttemptedStory":"0.000000","comparisonTokensPerSuccessfulStory":"0.000000","failedAttemptComparisonTokens":0,"inputTokens":0,"outputTokens":0,"reasoningOutputShare":null,"reasoningOutputTokens":0,"retryComparisonTokens":0},"warmupAttemptCount":0}],"attemptUsage":[{"arm":"sequential","attemptId":"sample-p1-seq","attemptUsageDigest":"sha256:cccccccccccccccccccccccccccccccccccccccccccccccccccccccccccccccc","completeness":"complete","pairNumber":1,"warmup":false,"workloadId":"sample"},{"arm":"parallel","attemptId":"sample-p1-par","attemptUsageDigest":"sha256:dddddddddddddddddddddddddddddddddddddddddddddddddddddddddddddddd","completeness":"complete","pairNumber":1,"warmup":false,"workloadId":"sample"}],"benchmarkAggregateDigest":"sha256:aaaaaaaaaaaaaaaaaaaaaaaaaaaaaaaaaaaaaaaaaaaaaaaaaaaaaaaaaaaaaaaa","benchmarkComparison":null,"benchmarkComparisonDigest":null,"incompleteReasons":["v1-comparison-unavailable"],"pairSummaries":[{"elapsedDeltaMs":-300,"pairNumber":1,"parallelAttemptUsageDigest":"sha256:dddddddddddddddddddddddddddddddddddddddddddddddddddddddddddddddd","parallelElapsedMs":700,"parallelTokens":{"cacheWriteInputTokens":0,"cachedInputRatio":null,"cachedInputTokens":0,"comparisonTokens":0,"comparisonTokensPerAttemptedStory":"0.000000","comparisonTokensPerSuccessfulStory":"0.000000","failedAttemptComparisonTokens":0,"inputTokens":0,"outputTokens":0,"reasoningOutputShare":null,"reasoningOutputTokens":0,"retryComparisonTokens":0},"sequentialAttemptUsageDigest":"sha256:cccccccccccccccccccccccccccccccccccccccccccccccccccccccccccccccc","sequentialElapsedMs":1000,"sequentialTokens":{"cacheWriteInputTokens":0,"cachedInputRatio":null,"cachedInputTokens":0,"comparisonTokens":0,"comparisonTokensPerAttemptedStory":"0.000000","comparisonTokensPerSuccessfulStory":"0.000000","failedAttemptComparisonTokens":0,"inputTokens":0,"outputTokens":0,"reasoningOutputShare":null,"reasoningOutputTokens":0,"retryComparisonTokens":0},"tokenDelta":0,"tokenRatio":null,"tokenVerdict":"complete","workloadId":"sample"}],"schemaVersion":"compass-builder.benchmark-token-report.v1","tokenVerdict":"complete","warmupsIncludedInMeasuredComparison":false}
